restaurant name,cuisine,restaurant url,general rating,restaurant in page number,delivery time,delivery fees,minimum order,tracking status,contactless,menu items,Address,Reviews URL,Pre-Order status,Payment types,reviews rating value,reviews Ratings count,reviews count,General review,Order Packaging reviews,Value for money reviews,Delivery time reviews,Quality of food reviews,Customer reviews
Mr Subs and Wraps,"Shawarma, Burgers, American",https://www.talabat.com/kuwait/restaurant/6360/mr-subs-wraps-egaila-tgo?aid=37,Very good,17,Within 26 mins,Free,0.000,Live Tracking,Contactless drop-off,French Fries Medium: 0.650; Chicken Classic Shawarma Local: 0.750; Steak Meat With cheddar Cheese: 1.900; Classic Chicken Fillet Local: 2.150; Glazed Chicken Local: 1.850; Lebanese Meat Shawarma Regular: 0.750; Sliders Box Local: 3.950; Shawarma Box: 2.700; Subs Box: 3.100; Wrap Extreme Box Local: 4.100; Extreme Fillet Box Local: 4.700; Turkish Extreme Box: 4.300; Gathering Pita Shawarma Box: 9.000; Shawarma Saj Gathering Box: 10.500; Gathering Slider Box: 10.500; Turkish Beef Shawarma: 1.550; Rice With Shawarma Meat: 1.850; Hummus with Shawarma Meat: 1.650; Italian shawarma Meat: 1.500; Lebanese Meat Shawarma Regular: 0.750; Meat Escander Shawarma: 1.150; Protein Pack Shawarma Meat: 2.100; Shawarma Arabic Bites Mix: 2.400; Meat Shawarma Arabic Bites: 2.400; Meat Saj Shawarma: 1.150; Subs Pita Shawarma Meat: 0.750; Subs Pita Shawarma Iskandar Meat: 0.750; Turkish  Chicken Shawarma local: 1.550; Rice With Shawarma Chicken Local: 1.850; Hummus with Shawarma Chicken: 1.450; Italian Shawarma Chicken local: 1.500; Chicken Classic Shawarma Local: 0.750; Chicken Escander Shawarma: 1.150; Protein pack Chicken: 2.100; Arabic Shawarma Bites Chicken: 2.400; Chicken  Saj Shawarma Local: 1.150; Pita Shawarma Escander Chicken: 0.750; Pita Chicken Shawarma local: 0.750; spicy chicken fillet Local: 2.150; Glazed chicken fillet Local: 2.200; Classic Chicken Fillet Local: 2.150; Classic Chicken Fillet Slider Local: 1.050; Glazed Chicken Fillet Slider Local: 1.150; Spicy Chicken Fillet Slider Local: 1.050; Classic Chicken Wrap Local: 1.600; Spicy Chicken Wrap Local: 1.600; chicken corn fiesta Local: 1.900; steak chicken Local: 1.900; Steak Meat With cheddar Cheese: 1.900; Chili Cheese Poppers: 1.350; Pots Pomelo & Pomegranate: 0.750; Hummus Palin: 0.950; Pots  Avocado Hummus With Cracker: 0.850; Pots Mutabbal With Crackers: 0.750; Cheese Fries: 1.150; Chicken Strips Local: 1.800; Glazed Chicken Local: 1.850; Signature Fries: 1.550; French Fries Large: 0.750; French Fries Medium: 0.650; Potato Balls Large: 0.950; Potato Balls Medium: 0.850; Caesars Salad With Grilled Chicken local: 2.250; Caesar Salad: 1.450; Pots Veg. Carrot And Cucumber: 0.500; Mango Salad: 1.750; Kale & Beetroot Salad: 1.750; Caesars Salad With ShawarmaChicken Local: 2.500; Caesars Salad with Meat Shawarma: 2.500; Carrot & Orange Juice: 1.500; Beetroot & Green Apple Juice: 1.500; Small Water: 0.250; Almarai Orange Juice: 0.600; Almarai Mango Juice: 0.600; Almarai Cocktail Juice: 0.600; Almarai Apple Juice: 0.600; Sprite: 0.600; Fanta Orange: 0.600; Cola-Cola: 0.600; Coca-Cola Light: 0.600; CHEESECAKE: 1.250; Molten Cake: 1.250; Spicy Barbecue Sauce: 0.200; Spicy Mayonnaise: 0.200; Mayonnaise: 0.200; Honey Mustard: 0.200; Garlic Sauce: 0.200; Tahini Sauce: 0.200; Signature Sauce: 0.200; Spicy Tahina Sauce: 0.200; Spicy Garlic Sauce: 0.200; Sauce Cheese Cheddar: 0.350; MUSHROOM SAUCE.: 0.250; Ranch Sauce: 0.200; BARBECUE SAUCE: 0.200,"in Egaila, Kuwait",https://www.talabat.com/kuwait/mr-subs-wraps,No,"Visa payment available, Mastercard payment available, KNET payment available, Cash payment available",4.0,48299,25932,"Mr Subs and Wraps is a restaurant located in Kuwait, serving a selection of Shawarma, Burgers, American that delivers across Abdullah Al-Mubarak - West Jeleeb, Abdullah Al-Salem, Abu Ftaira, Abu Halifa and Abu Hasaniya.; Their best selling dishes are Chicken Classic Shawarma Local, French Fries Medium, Lebanese Meat Shawarma Regular and Meat Saj Shawarma, although they have a variety of dishes and meals to choose from like Shawarma, Burgers, American.; They have been reviewed 48299 times by talabat users, with a rating of 4.",Very good,Very good,Very good,Very good,Heba A***: so good and the food. was fresh and it came on time (02 April 2025); Sura Ali ***: ูุงุฌูุชูู ูุดููุฉ ูุฌูุฏ ุดุนุฑู ูู ุนูุจุฉ ุงููุงูููุฒ ุงูููุฌูุฏู ุฏุงุฎู ุงูุทูุจ ููุฐุง ุงูุดูุก ููุฒุฒ ููุบุงูู (02 April 2025); Duna A***: ุงูุฏูุงู ุฒูุฑุฑุฑุฑุฑุฑุฑ ูุง ููููู (02 April 2025); Eman M***: ุงูุณููุฏูุชุด ูุงุถู ููู ุจุทุงุท ูุน ุงูู ูู ูู ููููุงุช ุงูุณุงูุฏูุชุด ุงูุฏุฌุงุฌ ูุนุฏูู ูููู ูุจุงุฑุฏ ุงูุซูููู ุฎูููููู ุงุณูุฃ (01 April 2025); ุทูุงู ุง***: ูููู ุงูุดูุฑูุง ููููู ูุดุญู ููุงุณู ูุฑุน ูููุงู ุงูุถู ุจูุซูุฑ (01 April 2025); Fotooh A***: the shawarma wasnโt nice and dry (01 April 2025); Eman Aldehani ***: ๐๐ป (31 March 2025); Mahamad M***: ุฃุชุนุณุณ ุดุงูุฑูุงโุฃูุซุฑ ูู ุนุดุฑูู ุดุงูุฑูุง ูููู ูู ููุณ ูุฑูู ูุงุญุฏ ุชุตูุฑูุงุงโุจุฎูููููโโ ูุง ุตูุต ููุง ุจุตู ูุง ุจูุฏููุณ. ุงุจุฏุงุงุงูุงูู ุดุงูุฑูุง โูุงุงุงุงุดูุฉ.. ุญุณุจูุง ุงููู ููุนู ุงููููู ๐๐ปุนูุถูุง ุนููู ูุงุงููู ุจูููุณูุง ?ุทูุจุงุช ูุง ููุญุฐู โ๏ธ ๐ป (31 March 2025); Yaqoub K***: food taste is not as expected. (31 March 2025); ***: ุฌูุฏู ุฌุฏุง (31 March 2025); ahmad d***: ุงูุทูุจ ุฌุงุก ุบูุท ูุจุงุงุงุงุฑุฏุฏ ุฏุงูู ูุฌู ุจุงุฑุฏุฏ (31 March 2025); hanouf a***: ุงูุงูู ุฌุฏุง ุณูุก (31 March 2025); Abdulaziz A***: ุชุดูู ูููุฉ ููุชุงุฒ ุฌุฏุงู (31 March 2025); Jamal r***: ุงูุชุบููู ููุชูุญ (28 March 2025); ุญูุฏ ุฌ***: ูุฐูุฐ ูุตู ุญุงุฑ ููุฑูุด (27 March 2025); Mashael J***: ุงูุงูู ูุตููู ุจุงุงุฑุฏ (26 March 2025); MoNaraNa R***: ุดุงูุฑูุง ูุญู ูุงููุฑู ูุงูุช ูุฐูุฐู ูุณูุทู ุงููุงูุฌู ุงูุตุญ ูููุง ุฌุฑุจููุง ุงูู ูุฑู ููุฏูุจ ุงูุชูุตูู ุฏุงูุฑูุช ูุฏู ุงูุจุงุจ ุงูุนุงุฏู ุณุงุนุชูู ุชููู ูููู ูุงูุฏููู (25 March 2025); ูุงูู ุง***: ูููุฑุฉ ุงูุซุงููุฉ ุงูุณุชูู ููุณ ููุง ูุงุงุงุงู !!! ุงูุธุงูุฑ ูุง ุชูุชููู ูููุงุญุธุงุช ุฒุจุงูููู (23 March 2025); ูุงูู ุง***: ุงูุณุชูู ููุณุช ูุงูุนุงุฏุฉ ุจูุงุทุนู (23 March 2025); Amml Ala ***: ุณูุฆ (20 March 2025); ุฑูู ุง***: the cheese not melted in the fries and chickenburger it seems uncooked the chicken very dry strong he was late (20 March 2025); Ahmed A***: wow (18 March 2025); Laila A***: ูุตู ูู ุบูุฑ ูุฎูู (16 March 2025); NASSER A***: ๐ููุชุงุฒ (14 March 2025); Hassan A***: ุฌููุฒุฏ ุชุดูู ูุญูู ูู ุบูุฑ ุตูุตู ุฑุงูุด ูุฐู ูุฑู ุงูุฎุจุฒ ููุฌูุฏ ูู ูุฑู ุดู ูุงูุต (14 March 2025); Hazem A***: the meat shawarma portion was not good and the ash bread mostly empty (14 March 2025); abdullah a***: The food was damaged in the boxes and the sandwiches was cold (12 March 2025); Zainab A***: food arrived very cold (12 March 2025); ***: ุตุฑุงุญู ูุจู ูุงู ุงุญูุง ุจูุงูุฏ ุฎุชุฑุจ ุญูู ูุทุนู ูู ููุณ ูุจู ูุดูุฑูุง ุฏุฌุงุฌ ุฑูุญุชูุง ูููู ุฒูุฑู ูุง ูุฏุฑุช ุฃููููุง ููุฃุณู (12 March 2025); Mohammad A***: good but wrong order (10 March 2025); Hassan H***: ูุบูุฑูู ุงูุฎุจุฒ ุงูุทุนู ูุง ูุณูู (09 March 2025); ุงุญูุฏ ู***: ุทุงูุจ ุณุชูู ุฏุฌุงุฌ ูุตูู ูุญู (07 March 2025); Saad Y***: ููุชุงุฒุ ุงูุทูุจ ูุงู ุณุฑูุน ู ุญุงุฑ (06 March 2025); Dhanya D***: The bread was old.. Very hard. Was not tasting good like before. Dissapointed It was good๐๐ (03 March 2025); Dawood A***: ูุฑูุช ูู ูุงู ูู ูุฎูู ูุน ุงูุทุจู ุงูุดูุงุฑูุง (28 February 2025); Mohammed B***: ุงูุงูู ุฌุฏุง ุจุงุงุงุงุฑุฏ (28 February 2025); Waleed A***: ุงูุงูู ูุฎููุท ุนูู ุจุนุถ ูุฃูู ูู ุฑุงูุญ ูุจุดุฑ - ุงูุงูู ุบูุฑ ูุธูู ูุงูุทุนู ูุนูู - ูุง ุงูุตุญ ููู (26 February 2025); Louai S***: I asked large fries they sent me medium I ordered large fries they sent small one (26 February 2025); Rafeef Alharbi ***: ููุชุงุฒ ูู ุงูุฐ ุงููุฌุจุงุช ูุฃูุธููุง (26 February 2025); Abdulrazzaq d***: no cheese sauce that i payed extra money for please provide me with a refund for the cheese sauce. fine (26 February 2025); Rafeef Alharbi ***: ุฑุงุฆุน ุฌุฏุง ุฌุฏุง ูุทุนูู ุฎูุงู ููู ุญุฌู ุงูุจุฑุบุฑ ุตุบูุฑ ููุนุงู ูุง ููุงุฑูุฉ ุจุงูุณุนุฑ (26 February 2025); MAI A***: cold too much sauce and the saj gave me a stomach ache ๐๐ป๐๐ป๐๐ป (25 February 2025); reem a***: ุงูุงูู ุจุงุฑุฏ ูุบูุฑ ุทุงุฒุฌ.. ูุงูุต ุงููุดุฑูุจ ุณุจุฑุงูุช. (25 February 2025); Aziz A***: ุชุฑุณู ุงูุดูุฑูุง ุดูู ูู ุทุฑุงุฑู (25 February 2025); Abdullah M***: ูุงููุชููู ุจุงูุฅุถุงูุงุช (25 February 2025); Manaleei A***: ุณูุก ูุงูู ูุงุฎุฑ ูุฑู ุงุทูุจ ููู ุงูุงูู ุจุงุงุงุงุฑุฏ ูุจุงุงุงูุช ูุฒูุฑุฑ ูููุดู ูุญุงุดูุง ุนูุงุฑ ุจุทู ููู ููุฑูุช ูู ูู ุงุญุฏ ูุฑุฏ (24 February 2025); Fatima Z***: ุงูุทูุจ ุณูุก ุฌุฏุง ููุง ุฑุงุญ ุงุทูุจ ููู ูุฑู ุซุงููู ูุงู ูุฏูู ูุบูุฑ ุตุงูุญ ููุงูู ุชู ุฑููู ูู ุงูููุงูู ุฎุณุฑ ูููุณ ุนูู ุงู ุทูู ูุตูู ุงูุทูุจ ุจุงุฑุฏ ุฌุฏุง (24 February 2025); Edrees M***: amazing food it didn't arrive in time (23 February 2025); kekah ุง***: ุณุฆ ุฌุฏุง ุงูุณูุทู ููุชููู ุงูุตูุงุญูู ูุงูุฃูู ุจุงุฑุฏ (23 February 2025); GHAZI A***: ุทูู ูู ุงูุงูู ูุฌุงุจู ุจุงุฑุฏ ุงููู ูุณุงูุญู (22 February 2025); Abeer H***: ุงููุญู ูุงุจุณ ููุฃุณู ุจุทูุก ูู ุจุณุฑุนุฉ ููุตู (22 February 2025); Mohammad A***: ุงูุงูู ูุตู ุจุงุฑุฏ ุฌุฏุงู ููุฐุง ุบูุฑ ููุจูู ุงูุจุทุงุท ุจุงุฑุฏ ุฌุฏุงู ูุดููุฉ ูุญุถุฑ ูู ูุฏุฉ ููุฐูู ุงูุณุงูุฏููุด ูุน ุงููู ุฑูุนูุง ุงูุงุณุนุงุฑ ูููู ุงูุฎุฏูุฉ ูุงูุฃูู ุณูุฆู (21 February 2025); AlAshram A***: ุงูุทูุจ ูุตู ุจุงุฑุฏ ุงูุทูุจ ูุตู ุจุงุฑุฏ (21 February 2025); Abdelrahman H***: thank you (18 February 2025); ุตุงูุญ ุงูุดุงููู ุง***: ุงูุดูุฑูุง ุณูุฆู ุฌุฏุง ุฌุฏุง ูุง ุทุนู ููุง ูููู ุฏุงุฎู ุงูุดูุฑูุง ุญุงุท ุฏุฌุงุฌ ูุซูู ููุท ุชุณุฏ ุงูููุณ ุงูุดูุฑูุง ุงูุดูุฑูุง ุฏุฌุงุฌ ุณูุฆ ุฌุฏุง ุฌุฏุง ูุง ุทุนู ููุง ูููู (18 February 2025); mervat e***: Taste in not good (18 February 2025); .... .***: ุชุญุณู ุงููุณุชูู ุนู ุงููุชุฑู ุงููุงุถูู ๐๐ผ๐๐ผ๐๐ผ good (17 February 2025); ุฑูู ุง***: ุงูุงูู ุฌุงูู ุจุงุงุงุงุงุงุฑุฏุฏุฏุฏ ููุด ูุงุงุญุจูุช ููุช ุทุงูุจู ุดูุฑูุง ูุญู (17 February 2025); talal k***: actual size is different than the photo (17 February 2025); sadiq a***: the food was cold and the test was not that much good the food was cold but the driver was nice person (16 February 2025); Saad Y***: ุงูุทูุจ ุบูุท (16 February 2025); hsn d***: ุชุฃุฎุฑ ุงูุทูุจ .. ูุงูุดุงูุฑูุง ุตุงูุฑุฉ ูู ูุฑูุด ููุณ ูุจู ุงูุณุงูู ุฑุงุญ ููุทูุฉ ุซุงููู ุดููู ูุงุฏุฑู (15 February 2025); ูููุญ ุง***: ูุงููู ูุฐูุฐุฐุฐุฐ ูุฏุญู ุฑููุฌู ุจุญุตู ุงูุงุญูุงุก ุจุณ ูุงุนูููู ูุฐูุฐุฐุฐุฐ ุงูุณูู ุจุงููู ุงุณุทูุฑููู ุนุฌูุจุจุจุจ ูุตูุญููู ุฌุฑุจููู (14 February 2025); ููุณู ุฎ***: ุงูุฎุจุฒ ุณูุฆ (14 February 2025); Mona A***: ุงูุฐ ุดุงูุฑูุง ูุญู (12 February 2025); v k***: ูุฐุงู ุงูุจุทุงุท ูุงู ููู ุนูู ู ุณูุก (11 February 2025); Mohammed A***: ุดุนุฑ ุจุงูุงูู ุงูุณุงูู ูุงูุฏู (10 February 2025); Atooma A***: ุงูุงูู ูููุบูู ุนุฏู ูููู ุทุงูุญ ุจุฑุง ูุจุงุฑุฏ ุซูุฌ (10 February 2025); ุจูููุณู ูุฏูุด ุจ***: ุงูุชุฌุฑุจู ููุชุงุฒู ุจุณ ุงูุณุนุฑ ุบุงูู ุดูู ูุฒูู ุจุงูุณุนุฑ (10 February 2025); Amooon 1***: ุงูุทูุจ ูุตู ุจุงุฑุฏ ูุงูุทุนู ูุงู ุณูุก ุฌุฏุง ูุงูุตููู ูุฏูู ูุชูุทุน ูุงูุฌุจู ูุฏูู ุฏุงูุนู ูจ ุฏูุงููุฑ ูุงูุงูู ููุญูู ูุจุง (10 February 2025); Badria A***: ๐ ููุฉ ูู ุงูุงุฎูุงู (09 February 2025); Sana A***: the food arrived very very cold and not fresh at all (09 February 2025); hussain a***: ุงูุงูู ูุตู ูููู ุฑูุญู ุณูุฆู ุบูุฑ ุนู ูู ูุฑู !! (08 February 2025); Aziz A***: Way too cold! (08 February 2025); ***: ุงูุฑุฌุงู ุงูู ูุตู ุทูุจู ููุฉ ุจุงูุงุญุชุฑุงู ู ุฎููู ู ูุธูู (08 February 2025); Almas ***: ุงูุงูู ูุตููู ุจุงุฑุฏ ๐๐ (07 February 2025); hajer a***: ุงูุงูู ุจุงุฑุฏ ูุงููููู ููุชูุง ุงููุทุนู ุจูุฏู ุนูู ููุงุฏู ุงูุงูู ูุตู ุจุงุฑุฏ (06 February 2025); ุฎููุฏ ุง***: ุงูุดุงูุฑูุง ูุงุงุงุดูุฉ ูุนูู ูุงุฒู ูุดุชุฑู ุงูุซูููุฉุ! ุงูุณุงูู ูุญุชุฑู (06 February 2025); Fatma A***: ุงูุจูุจุณู ููููุฏ (05 February 2025); Abdulrahman A***: ุดูุฑูุง ุงููุญู ุณูุฆุฉ (05 February 2025); amani a***: ุงูุณูุฒุฑ ุญููู ููู ุงูุตูุต ูููุชู ุงูู ูู ุงูุฑุจุน ุฌูู ูุงุถู ุ ุงูููุงุณูู ุฌูู ุงูุฎุจุฒ ุญุงุงุงุงูู ุฌูู ููู ูู ุฎุจุฒ ุจุฑูุฑ (05 February 2025); Ghadeer B***: ุชุฌุฑุจุฉ ูุงุดูู ุงูุงูู ูุงุตููู ุซูุฌ ูู ุจุณ ุจุงุฑุฏ (05 February 2025); Abdullah A***: ุงูุทูุจ ุบูุท ุทูุจุช ุณููุฌุฑ ูุฑุงูุฒ ููุตููู ุจุทุงุท ุจุงูุฌุจู ๐ (05 February 2025); Issam S***: we ordered chicken shawarma we got meat shawarma (04 February 2025); Akhila ***: food waa soo yummyโฆpacking was really very good the person who bring my food so kind and polite (03 February 2025); ุนุจุฏุงููุฌูุฏ ุง***: ุงุฎุฑ ุชุฌุฑุจู ูู ูุน ุงููุทุนู ุงููุงุดู (03 February 2025); Zayd A***: ููุงุณู ุชุบูุฑ ุทุนู ุงูุดุงูุฑูุง ุงููุญู ูุจู ูุงู ูุฐูุฐ ุงูุญูู ุณูุก ููุงุจุณ ุงููู ูุฏูู ุงููุนูู (03 February 2025); ุฌูุงู ุณ***: ูุตู ุงูุงูู ุบูุฑ ุญุงุฑู (03 February 2025); bashayer b***: The taste of cardamom is too much. I hope to reduce it next time. (02 February 2025); ุตูุงุก ุน***: ุงูู ูุฑู ุงุทูุจ ุณูุฏููุดุฉ ุงูุดุงููุฑูุง ุจุงูุฎุจุฒ ุงูุงูุทุงูู ูุง ุนุฌุจุชูู ุงููุญู ูุงุดู ูุงุทุฑุงูู ูุญุฑูููุงูุงูู ูุตู ุจุงุฑุฏ (02 February 2025); shaikha a***: ุงูุงูู ูุฐูุฐุญูููู (02 February 2025); ุฃู ูุญูุฏ ุง***: ุจุงุฑู ุงููู ููู ุฑุงุฆุน (02 February 2025); Ucf a***: decent. (01 February 2025); Jenny M***: shawarma is delicious and clean !!! i wil order again and the packaging and portion is good !!!! (01 February 2025); Abulhamid A***: ูุฐูุฐ ุฌุฏุง (01 February 2025); ุดูู ุง***: ุงูุจุทุงุท ุญุฏุงุงุง ูุฏูู ุจุงุงุงุงูุช ูุงููุฃูู ุงูุฌูู ููููู ุญููู (31 January 2025); Batool A***: ุญูู ููุดู๐ฉท ุงูุชูุตูู ุงูููุช ููุงุณุจ ุฌุฏูุง (31 January 2025); Kha Alhamly ุญ***: ุฌูุฏุฉ (31 January 2025); anfal a***: ูููู ููููู (30 January 2025); Abdulrahman A***: ูู ุดู ุญูู (30 January 2025)
